{
  "note": "文本映射配置：错别字纠正、简写扩展、品牌别名、容量标准化",
  "typoCorrections": {
    "雾松蓝": "雾凇蓝",
    "曜石黑": "曜石黑",
    "星岩黑": "星岩黑",
    "玥金": "曜金",
    "玥石黑": "曜石黑",
    "告白": "告白",
    "空格白": "空白格",
    "玉龙雪": "玉石绿",
    "锆石黑": "琥珀黑",
    "晶钻粉": "玛瑙粉",
    "粉梦生花": "玛瑙粉"
  },
  "abbreviations": {
    "GT5": "Watch GT 5",
    "GT4": "Watch GT 4",
    "GT3": "Watch GT 3",
    "GT2": "Watch GT 2",
    "GT": "Watch GT",
    "SE": "Watch SE",
    "D2": "Watch D2",
    "D": "Watch D",
    "Fit": "Watch Fit",
    "NFC": "NFC",
    "eSIM": "eSIM",
    "esim": "eSIM",
    "5G": "5G",
    "4G": "4G",
    "3G": "3G",
    "WiFi": "WiFi",
    "wifi": "WiFi",
    "WIFI": "WiFi"
  },
  "brandAliases": {
    "华为": ["HUAWEI", "huawei", "Huawei"],
    "小米": ["XIAOMI", "xiaomi", "Xiaomi", "MI", "mi"],
    "红米": ["Redmi", "redmi", "REDMI"],
    "vivo": ["VIVO", "Vivo"],
    "OPPO": ["oppo", "Oppo"],
    "荣耀": ["HONOR", "honor", "Honor"],
    "realme": ["Realme", "REALME", "真我"],
    "一加": ["OnePlus", "oneplus", "ONEPLUS"],
    "魅族": ["MEIZU", "meizu", "Meizu"],
    "三星": ["Samsung", "samsung", "SAMSUNG"],
    "苹果": ["Apple", "apple", "APPLE", "iPhone", "iphone"]
  },
  "capacityNormalizations": {
    "8GB+256GB": "8+256",
    "8G+256G": "8+256",
    "8+256GB": "8+256",
    "8GB+256G": "8+256",
    "12GB+512GB": "12+512",
    "12G+512G": "12+512",
    "12+512GB": "12+512",
    "12GB+512G": "12+512",
    "16GB+512GB": "16+512",
    "16G+512G": "16+512",
    "16+512GB": "16+512",
    "16GB+512G": "16+512",
    "16GB+1TB": "16+1T",
    "16G+1T": "16+1T",
    "16+1TB": "16+1T",
    "24GB+1TB": "24+1T",
    "24G+1T": "24+1T",
    "24+1TB": "24+1T",
    "6GB+128GB": "6+128",
    "6G+128G": "6+128",
    "6+128GB": "6+128",
    "6GB+128G": "6+128",
    "8GB+128GB": "8+128",
    "8G+128G": "8+128",
    "8+128GB": "8+128",
    "8GB+128G": "8+128",
    "256GB": "256",
    "512GB": "512",
    "1TB": "1T",
    "128GB": "128",
    "64GB": "64",
    "32GB": "32"
  }
}
